{
  "schemaVersion": 1,
  "screenshotRoot": "tests/visual-regression",
  "capture": {
    "resolution": [1280, 720],
    "format": "png",
    "colorSpace": "srgb-after-tonemap",
    "warmupFrames": 8,
    "captureFrame": 9,
    "fixedTimestepSeconds": 0.016666667
  },
  "comparison": {
    "algorithm": "per-channel-linearized-rgb-mae-and-p95-with-heatmap-diff",
    "maxMeanAbsoluteError": 0.012,
    "maxP95AbsoluteError": 0.05,
    "maxDifferentPixelFraction": 0.01,
    "platformBuckets": [
      "windows-nvidia"
    ]
  },
  "cpuChecks": {
    "manualExposure": [
      {
        "inputLuminance": 2.5,
        "exposure": 0.25,
        "expectedLuminance": 0.625
      },
      {
        "inputLuminance": 2.5,
        "exposure": 1.0,
        "expectedLuminance": 2.5
      }
    ],
    "pointLightAttenuation": {
      "rangeMeters": 1000.0,
      "nearDistanceMeters": 2.0,
      "farDistanceMeters": 4.0,
      "expectedNearToFarRatio": 4.0
    },
    "shadowTexelSnap": {
      "cascadeWorldRadius": 24.0,
      "shadowMapSize": 4096,
      "unsnappedLightSpaceCenter": [3.14159, -2.71828],
      "expectedTexelSize": 0.01171875,
      "maxSnapErrorTexels": 0.5
    },
    "materialExpectations": [
      {
        "name": "matte_gray_18pct",
        "baseColor": [0.18, 0.18, 0.18],
        "metallic": 0.0,
        "roughness": 1.0,
        "expectedClass": "diffuse"
      },
      {
        "name": "chrome_smooth",
        "baseColor": [1.0, 1.0, 1.0],
        "metallic": 1.0,
        "roughness": 0.02,
        "expectedClass": "mirror_metal"
      },
      {
        "name": "clearcoat_plastic",
        "baseColor": [0.8, 0.02, 0.02],
        "metallic": 0.0,
        "roughness": 0.45,
        "clearcoat": 1.0,
        "clearcoatRoughness": 0.05,
        "expectedClass": "coated_dielectric"
      },
      {
        "name": "thin_glass",
        "baseColor": [1.0, 1.0, 1.0],
        "metallic": 0.0,
        "roughness": 0.0,
        "transmission": 1.0,
        "ior": 1.5,
        "expectedClass": "thin_transmission"
      }
    ]
  },
  "scenes": [
    {
      "id": "box_direct_lighting_front_face",
      "category": "lighting",
      "status": "active",
      "asset": "models/glTF-Sample-Models/2.0/Box/glTF/Box.gltf",
      "renderMode": "final-lit",
      "camera": {
        "position": [0.0, 0.0, 4.0],
        "target": [0.0, 0.0, 0.0],
        "verticalFovDegrees": 50.0
      },
      "lighting": {
        "environment": "hdr/citrus_orchard_road_puresky_4k.exr",
        "environmentIntensity": 0.0,
        "exposure": 1.0,
        "directionalLight": {
          "illuminanceLux": 40000.0,
          "direction": [-0.35, -0.75, -0.55],
          "color": [1.0, 0.96, 0.9]
        },
        "pointLights": []
      },
      "probes": [
        {
          "id": "front_face_receives_direct_light",
          "kind": "dominant_color_fraction",
          "regionUv": [0.470, 0.390, 0.060, 0.120],
          "targetColor": [0.70, 0.04, 0.02],
          "maxDistance": 0.30,
          "minimumFraction": 0.35
        }
      ],
      "screenshots": {
        "golden": "tests/visual-regression/golden/{platform}/box_direct_lighting_front_face.png",
        "candidate": "test_results/visual-regression/candidate/{platform}/box_direct_lighting_front_face.png",
        "diff": "test_results/visual-regression/diff/{platform}/box_direct_lighting_front_face.png"
      }
    },
    {
      "id": "diagnostic_default_scene",
      "category": "material",
      "status": "active",
      "asset": "__default_test_scene__",
      "renderMode": "final-lit",
      "camera": {
        "position": [0.0, 1.0, 4.0],
        "target": [0.0, 0.75, 0.0],
        "verticalFovDegrees": 50.0
      },
      "lighting": {
        "environment": "hdr/citrus_orchard_road_puresky_4k.exr",
        "environmentIntensity": 1.0,
        "exposure": 0.25,
        "directionalLight": {
          "illuminanceLux": 10000.0,
          "direction": [-0.35, -0.75, -0.55],
          "color": [1.0, 0.96, 0.9]
        },
        "pointLights": []
      },
      "probes": [
        {
          "id": "center_smoke_probe",
          "kind": "candidate_exists",
          "pixel": [640, 360]
        }
      ],
      "screenshots": {
        "golden": "tests/visual-regression/golden/{platform}/diagnostic_default_scene.png",
        "candidate": "test_results/visual-regression/candidate/{platform}/diagnostic_default_scene.png",
        "diff": "test_results/visual-regression/diff/{platform}/diagnostic_default_scene.png"
      }
    },
    {
      "id": "texture_settings_single_sided_culling",
      "category": "material",
      "status": "active",
      "asset": "models/glTF-Sample-Models/2.0/TextureSettingsTest/glTF/TextureSettingsTest.gltf",
      "renderMode": "final-lit",
      "camera": {
        "position": [0.0, 0.0, 12.0],
        "target": [0.0, 0.0, 0.0],
        "verticalFovDegrees": 45.0
      },
      "lighting": {
        "environment": "hdr/citrus_orchard_road_puresky_4k.exr",
        "environmentIntensity": 1.0,
        "exposure": 0.25,
        "directionalLight": {
          "illuminanceLux": 10000.0,
          "direction": [-0.35, -0.75, -0.55],
          "color": [1.0, 0.96, 0.9]
        },
        "pointLights": []
      },
      "probes": [
        {
          "id": "single_sided_test_column_stays_green",
          "kind": "dominant_color_fraction",
          "regionUv": [0.500, 0.410, 0.052, 0.090],
          "targetColor": [0.03, 0.78, 0.05],
          "maxDistance": 0.22,
          "minimumFraction": 0.75
        },
        {
          "id": "double_sided_test_column_stays_green",
          "kind": "dominant_color_fraction",
          "regionUv": [0.500, 0.515, 0.052, 0.090],
          "targetColor": [0.03, 0.78, 0.05],
          "maxDistance": 0.22,
          "minimumFraction": 0.75
        },
        {
          "id": "sample_pass_column_stays_green",
          "kind": "dominant_color_fraction",
          "regionUv": [0.621, 0.410, 0.052, 0.090],
          "targetColor": [0.03, 0.78, 0.05],
          "maxDistance": 0.22,
          "minimumFraction": 0.75
        }
      ],
      "screenshots": {
        "golden": "tests/visual-regression/golden/{platform}/texture_settings_single_sided_culling.png",
        "candidate": "test_results/visual-regression/candidate/{platform}/texture_settings_single_sided_culling.png",
        "diff": "test_results/visual-regression/diff/{platform}/texture_settings_single_sided_culling.png"
      }
    },
    {
      "id": "sponza_lion_relief_culling",
      "category": "material",
      "status": "active",
      "asset": "models/glTF-Sample-Models/2.0/Sponza/glTF/Sponza.gltf",
      "renderMode": "final-lit",
      "camera": {
        "position": [8.2, 1.4, -0.3],
        "target": [10.25, 1.4, -0.3],
        "verticalFovDegrees": 45.0
      },
      "lighting": {
        "environment": "hdr/citrus_orchard_road_puresky_4k.exr",
        "environmentIntensity": 1.0,
        "exposure": 0.25,
        "directionalLight": {
          "illuminanceLux": 10000.0,
          "direction": [-0.35, -0.75, -0.55],
          "color": [1.0, 0.96, 0.9]
        },
        "pointLights": []
      },
      "probes": [
        {
          "id": "lion_face_region_has_embossed_detail",
          "kind": "region_luminance_stddev",
          "regionUv": [0.405, 0.330, 0.190, 0.360],
          "minimumStdDev": 0.035
        }
      ],
      "screenshots": {
        "golden": "tests/visual-regression/golden/{platform}/sponza_lion_relief_culling.png",
        "candidate": "test_results/visual-regression/candidate/{platform}/sponza_lion_relief_culling.png",
        "diff": "test_results/visual-regression/diff/{platform}/sponza_lion_relief_culling.png"
      }
    },
    {
      "id": "cornell_box_local_light_occlusion",
      "category": "shadow",
      "status": "active",
      "asset": "models/validation/cornell_box_local_light.gltf",
      "renderMode": "final-lit",
      "camera": {
        "position": [0.0, 1.05, 4.1],
        "target": [0.0, 0.95, 0.0],
        "verticalFovDegrees": 36.0
      },
      "lighting": {
        "environment": "hdr/citrus_orchard_road_puresky_4k.exr",
        "environmentIntensity": 0.0,
        "exposure": 0.25,
        "authoredLightsFromAsset": true,
        "directionalLight": {
          "illuminanceLux": 0.0,
          "direction": [0.0, -1.0, 0.0],
          "color": [1.0, 1.0, 1.0]
        },
        "pointLights": []
      },
      "probes": [
        {
          "id": "blocker_reduces_floor_contact_visibility",
          "kind": "relative_region_luminance",
          "litRegionUv": [0.360, 0.840, 0.080, 0.060],
          "shadowRegionUv": [0.460, 0.840, 0.120, 0.060],
          "maximumShadowToLitRatio": 0.70
        },
        {
          "id": "blocker_shadow_has_soft_penumbra",
          "kind": "shadow_softness_gradient",
          "umbraRegionUv": [0.480, 0.840, 0.035, 0.035],
          "penumbraRegionUv": [0.540, 0.840, 0.035, 0.035],
          "litRegionUv": [0.560, 0.840, 0.035, 0.035],
          "minimumUmbraToPenumbraDelta": 0.08,
          "minimumPenumbraToLitDelta": 0.08
        },
        {
          "id": "left_wall_keeps_cornell_red",
          "kind": "dominant_color_fraction",
          "regionUv": [0.225, 0.460, 0.105, 0.220],
          "targetColor": [0.89, 0.44, 0.36],
          "maxDistance": 0.20,
          "minimumFraction": 0.65
        },
        {
          "id": "right_wall_keeps_cornell_green",
          "kind": "dominant_color_fraction",
          "regionUv": [0.710, 0.460, 0.075, 0.220],
          "targetColor": [0.60, 0.79, 0.46],
          "maxDistance": 0.20,
          "minimumFraction": 0.65
        }
      ],
      "screenshots": {
        "golden": "tests/visual-regression/golden/{platform}/cornell_box_local_light_occlusion.png",
        "candidate": "test_results/visual-regression/candidate/{platform}/cornell_box_local_light_occlusion.png",